{
  "$schema": "http://json-schema.org/draft-07/schema#",
  "$id": "https://catch.app/contracts/firestore/event_invite_links.schema.json",
  "title": "EventInviteLinkDocument",
  "description": "Opaque event invitation metadata stored at eventInviteLinks/{inviteLinkId}. The public bearer token is stored separately in a server-only secret document.",
  "type": "object",
  "additionalProperties": false,
  "x-firestore-collection": "eventInviteLinks",
  "x-firestore-path": "eventInviteLinks/{inviteLinkId}",
  "x-document-id-field": "id",
  "x-owner": "event invite link callables and event-success scorecard recomputation",
  "required": [
    "eventId",
    "organizerId",
    "hostUid",
    "label",
    "source",
    "tokenHash",
    "openCount",
    "requestCount",
    "confirmedCount",
    "paidCount",
    "checkedInCount",
    "catcherCount",
    "matchCount",
    "chatStartedCount",
    "disabledAt",
    "createdAt",
    "updatedAt"
  ],
  "properties": {
    "eventId": {
      "$ref": "../shared/event_common.schema.json#/definitions/documentId",
      "x-catch-ownership": "callable-owned"
    },
    "organizerId": {
      "$ref": "../shared/event_common.schema.json#/definitions/documentId",
      "x-catch-ownership": "callable-owned"
    },
    "hostUid": {
      "$ref": "../shared/event_common.schema.json#/definitions/documentId",
      "x-catch-ownership": "callable-owned"
    },
    "label": {
      "type": "string",
      "minLength": 1,
      "maxLength": 80,
      "x-catch-ownership": "callable-owned"
    },
    "source": {
      "type": [
        "string",
        "null"
      ],
      "minLength": 1,
      "maxLength": 80,
      "x-catch-ownership": "callable-owned"
    },
    "tokenHash": {
      "type": "string",
      "minLength": 64,
      "maxLength": 64,
      "pattern": "^[a-f0-9]{64}$",
      "x-catch-ownership": "callable-owned"
    },
    "contractVersion": {
      "type": "integer",
      "minimum": 2,
      "maximum": 2,
      "x-catch-ownership": "callable-owned"
    },
    "linkKind": {
      "type": "string",
      "enum": [
        "hostChannel",
        "directRecipient",
        "attendeeReferrer",
        "promoter",
        "partner"
      ],
      "x-catch-ownership": "callable-owned"
    },
    "ownerContactId": {
      "type": ["string", "null"],
      "minLength": 1,
      "maxLength": 180,
      "x-catch-ownership": "callable-owned"
    },
    "ownerUid": {
      "type": ["string", "null"],
      "minLength": 1,
      "maxLength": 180,
      "x-catch-ownership": "callable-owned"
    },
    "intendedRecipientContactId": {
      "type": ["string", "null"],
      "minLength": 1,
      "maxLength": 180,
      "x-catch-ownership": "callable-owned"
    },
    "campaignId": {
      "type": ["string", "null"],
      "minLength": 1,
      "maxLength": 180,
      "x-catch-ownership": "callable-owned"
    },
    "issuanceChannel": {
      "type": "string",
      "enum": [
        "hostApp",
        "consumerApp",
        "runtimeWeb",
        "campaign",
        "api",
        "formAutomation"
      ],
      "x-catch-ownership": "callable-owned"
    },
    "destinationKind": {
      "type": "string",
      "enum": [
        "catchEvent",
        "eventRuntime",
        "externalBooking",
        "marketingLanding"
      ],
      "x-catch-ownership": "callable-owned"
    },
    "tokenVersion": {
      "type": "integer",
      "minimum": 1,
      "maximum": 10,
      "x-catch-ownership": "callable-owned"
    },
    "attributionWindowEndsAt": {
      "$ref": "../shared/event_common.schema.json#/definitions/nullableTimestamp",
      "x-catch-ownership": "callable-owned"
    },
    "openCount": {
      "type": "integer",
      "minimum": 0,
      "x-catch-ownership": "callable-owned"
    },
    "likelyHumanOpenCount": {
      "type": "integer",
      "minimum": 0,
      "x-catch-ownership": "callable-owned"
    },
    "shareIntentCount": {
      "type": "integer",
      "minimum": 0,
      "x-catch-ownership": "callable-owned"
    },
    "verifiedRegistrationCount": {
      "type": "integer",
      "minimum": 0,
      "x-catch-ownership": "trigger-owned"
    },
    "referredRegistrationCount": {
      "type": "integer",
      "minimum": 0,
      "x-catch-ownership": "trigger-owned"
    },
    "referredCheckedInCount": {
      "type": "integer",
      "minimum": 0,
      "x-catch-ownership": "trigger-owned"
    },
    "requestCount": {
      "type": "integer",
      "minimum": 0,
      "x-catch-ownership": "callable-owned"
    },
    "confirmedCount": {
      "type": "integer",
      "minimum": 0,
      "x-catch-ownership": "callable-owned"
    },
    "paidCount": {
      "type": "integer",
      "minimum": 0,
      "x-catch-ownership": "callable-owned"
    },
    "checkedInCount": {
      "type": "integer",
      "minimum": 0,
      "x-catch-ownership": "callable-owned"
    },
    "catcherCount": {
      "type": "integer",
      "minimum": 0,
      "x-catch-ownership": "trigger-owned"
    },
    "matchCount": {
      "type": "integer",
      "minimum": 0,
      "x-catch-ownership": "trigger-owned"
    },
    "chatStartedCount": {
      "type": "integer",
      "minimum": 0,
      "x-catch-ownership": "trigger-owned"
    },
    "disabledAt": {
      "$ref": "../shared/event_common.schema.json#/definitions/nullableTimestamp",
      "x-catch-ownership": "callable-owned"
    },
    "createdAt": {
      "$ref": "../shared/event_common.schema.json#/definitions/timestamp",
      "x-catch-ownership": "callable-owned"
    },
    "updatedAt": {
      "$ref": "../shared/event_common.schema.json#/definitions/timestamp",
      "x-catch-ownership": "callable-owned"
    }
  }
}
